{
  "schema": "sparkglm.qualification/v1",
  "id": "2026-09-03-tp2-collectives",
  "title": "2026 09 03 tp2 collectives",
  "date": "2026-09-03",
  "state": "measurement",
  "qualification_level": "legacy",
  "target": "Historical experiment evidence retained for reference",
  "change": {
    "baseline_ref": null,
    "candidate_ref": null,
    "working_tree_clean": null,
    "provenance": [
      "Migrated from pre-policy SparkGLM evidence without retroactive certification."
    ]
  },
  "environment": {},
  "gates": [],
  "metrics": [],
  "artifacts": [
    {
      "path": "2026-09-03-tp2-collectives.md",
      "kind": "human-report",
      "sha256": "0ae5a6ae325c2f2b539659d9fefb48cd0c4f9efb0b074e050904463870648054"
    }
  ],
  "limitations": [
    "This evidence predates qualification-v1.",
    "Only facts present in the retained artifact may be claimed.",
    "Missing commit, image, environment, warmup, or quality fields were not invented during migration."
  ],
  "attestation": {
    "status": "legacy",
    "maintainer": null,
    "date": null
  }
}
