{
  "schema": "sparkglm.qualification/v1",
  "id": "2026-09-03-exl3-m64-fat-tile",
  "title": "2026 09 03 exl3 m64 fat tile",
  "date": "2026-09-03",
  "state": "measurement",
  "qualification_level": "legacy",
  "target": "Historical experiment evidence retained for reference",
  "change": {
    "baseline_ref": null,
    "candidate_ref": null,
    "working_tree_clean": null,
    "provenance": [
      "Migrated from pre-policy SparkGLM evidence without retroactive certification."
    ]
  },
  "environment": {},
  "gates": [],
  "metrics": [],
  "artifacts": [
    {
      "path": "2026-09-03-exl3-m64-fat-tile.md",
      "kind": "human-report",
      "sha256": "f1b0e8514a6dd975728c2075089279209f2765c47c3bb16e6f820f6d5c25c9a6"
    }
  ],
  "limitations": [
    "This evidence predates qualification-v1.",
    "Only facts present in the retained artifact may be claimed.",
    "Missing commit, image, environment, warmup, or quality fields were not invented during migration."
  ],
  "attestation": {
    "status": "legacy",
    "maintainer": null,
    "date": null
  }
}
