{
  "schema": "sparkglm.qualification/v1",
  "id": "2026-09-03-c4-capacity-fix",
  "title": "2026 09 03 c4 capacity fix",
  "date": "2026-09-03",
  "state": "measurement",
  "qualification_level": "legacy",
  "target": "Historical experiment evidence retained for reference",
  "change": {
    "baseline_ref": null,
    "candidate_ref": null,
    "working_tree_clean": null,
    "provenance": [
      "Migrated from pre-policy SparkGLM evidence without retroactive certification."
    ]
  },
  "environment": {},
  "gates": [],
  "metrics": [],
  "artifacts": [
    {
      "path": "2026-09-03-c4-capacity-fix.md",
      "kind": "human-report",
      "sha256": "234c370a19b38f50f5a8f417d71c161a7af4e6e9cee1bc74bee319eb5da8eccd"
    }
  ],
  "limitations": [
    "This evidence predates qualification-v1.",
    "Only facts present in the retained artifact may be claimed.",
    "Missing commit, image, environment, warmup, or quality fields were not invented during migration."
  ],
  "attestation": {
    "status": "legacy",
    "maintainer": null,
    "date": null
  }
}
