{
  "schema": "sparkglm.qualification/v1",
  "id": "2026-08-29-cold-prefill-baseline",
  "title": "Cold-prefill baseline ladder",
  "date": "2026-08-29",
  "state": "baseline",
  "qualification_level": "legacy",
  "target": "Cold-prefill throughput across context lengths",
  "change": {
    "baseline_ref": null,
    "candidate_ref": null,
    "working_tree_clean": null,
    "provenance": [
      "Migrated from pre-policy SparkGLM evidence without retroactive certification."
    ]
  },
  "environment": {},
  "gates": [],
  "metrics": [],
  "artifacts": [
    {
      "path": "cold-prefill.md",
      "kind": "human-report",
      "sha256": "74e620783ceebdf180108a49be09081d17eae16fbc78b291d2e050c8707b1912"
    },
    {
      "path": "_cold_prefill_raw.json",
      "kind": "raw-receipt",
      "sha256": "ea8a86a3ec895207a96eb144f0f1c1c04781bbc6fb2b31f024290b9d6894760f"
    }
  ],
  "limitations": [
    "This evidence predates qualification-v1.",
    "Only facts present in the retained artifact may be claimed.",
    "Missing commit, image, environment, warmup, or quality fields were not invented during migration."
  ],
  "attestation": {
    "status": "legacy",
    "maintainer": null,
    "date": null
  }
}
