{
  "schema": "sparkglm.qualification/v1",
  "id": "glm53-four-stream-prose-041263ab23",
  "title": "glm53 four stream prose 041263ab23",
  "date": null,
  "state": "measurement",
  "qualification_level": "legacy",
  "target": "Historical experiment evidence retained for reference",
  "change": {
    "baseline_ref": null,
    "candidate_ref": null,
    "working_tree_clean": null,
    "provenance": [
      "Migrated from pre-policy SparkGLM evidence without retroactive certification."
    ]
  },
  "environment": {},
  "gates": [],
  "metrics": [],
  "artifacts": [
    {
      "path": "glm53-four-stream-prose-041263ab23.json",
      "kind": "raw-receipt",
      "sha256": "71a985847d91a7130baef1ecd1d279f80aa9d269c793ab46a9d16345083f1b6d"
    }
  ],
  "limitations": [
    "This evidence predates qualification-v1.",
    "Only facts present in the retained artifact may be claimed.",
    "Missing commit, image, environment, warmup, or quality fields were not invented during migration."
  ],
  "attestation": {
    "status": "legacy",
    "maintainer": null,
    "date": null
  }
}
