{
  "schema": "sparkglm.qualification/v1",
  "id": "2026-09-01-throughput-baseline",
  "title": "Throughput baseline",
  "date": "2026-09-01",
  "state": "baseline",
  "qualification_level": "legacy",
  "target": "Historical two-Spark throughput baseline",
  "change": {
    "baseline_ref": null,
    "candidate_ref": null,
    "working_tree_clean": null,
    "provenance": [
      "Migrated from pre-policy SparkGLM evidence without retroactive certification."
    ]
  },
  "environment": {},
  "gates": [],
  "metrics": [],
  "artifacts": [
    {
      "path": "2026-09-01-throughput-baseline.md",
      "kind": "human-report",
      "sha256": "67cdf13ff5f5d1bcdfc14e5a16e712806a0b6ac6f8e2a9d4975581d24eb4bb6e"
    },
    {
      "path": "2026-09-01-throughput-baseline.json",
      "kind": "raw-receipt",
      "sha256": "d0944fad135676fcd91474f2c5d1f08e48d810ca32ce1da15e5c163fc579a611"
    }
  ],
  "limitations": [
    "This evidence predates qualification-v1.",
    "Only facts present in the retained artifact may be claimed.",
    "Missing commit, image, environment, warmup, or quality fields were not invented during migration."
  ],
  "attestation": {
    "status": "legacy",
    "maintainer": null,
    "date": null
  }
}
